### ISSUE TITLE
packages.microsoft.com webserver cluster member 2620:1ec:29:1::67 not responding

### ISSUE THREAD

**Issue by on8pz** [microsoft/linux-package-repositories#184]
Not sure this is the correct place to report this, but I have no idea where else to report it.

**Describe the issue**
I have been intermittently unable to connect to packages.microsoft.com over HTTPS for the past few weeks.
Today I think I found the culprit. One webserver cluster member is not responding to HTTP(S) requests correctly.

Other connections to other packages.microsoft.com webservers work fine, but the webserver with IP 2620:1ec:29:1::67 accepts the TCP connection and then hangs forever.
So depending on the DNS lookup result or the routing to microsoft of my provider I get connected to a different webserver and then it does work. When the connection gets sent to webserver with IP 2620:1ec:29:1::67 it times out.

**When did the issue occur?**
Started occuring a few weeks ago.

**If applicable, what package did you attempt to install, and from which repo?**
Not really applicable, but I was trying to apt-update and have the ms-teams repo in my sources.list

**Steps to Reproduce**
hans@late7420:~$ wget -O /dev/null https://packages.microsoft.com/repos/ms-teams
--2024-11-08 12:03:40--  https://packages.microsoft.com/repos/ms-teams
Resolving packages.microsoft.com (packages.microsoft.com)... 2620:1ec:29:1::67, 13.107.253.67
Connecting to packages.microsoft.com (packages.microsoft.com)|2620:1ec:29:1::67|:443... connected.
[[[hangs forever]]]
^C

**Actual Result**
Web server accepts the TCP connection, but then never sends any data
Web request then hangs forever (or until client times out)

**Expected Result**
Web server should serve data over the HTTPS connection

**Screenshots**

hans@late7420:~$ host packages.microsoft.com
packages.microsoft.com is an alias for pmc-prod-afd-endpoint-evdhh8f8byhsezfp.b01.azurefd.net.
pmc-prod-afd-endpoint-evdhh8f8byhsezfp.b01.azurefd.net is an alias for shed.dual-low.s-part-0039.t-0009.t-msedge.net.
shed.dual-low.s-part-0039.t-0009.t-msedge.net is an alias for azurefd-t-fb-prod.trafficmanager.net.
azurefd-t-fb-prod.trafficmanager.net is an alias for dual.s-part-0039.t-0009.fb-t-msedge.net.
dual.s-part-0039.t-0009.fb-t-msedge.net is an alias for s-part-0039.t-0009.fb-t-msedge.net.
s-part-0039.t-0009.fb-t-msedge.net has address 13.107.253.67
s-part-0039.t-0009.fb-t-msedge.net has IPv6 address 2620:1ec:29:1::67

hans@late7420:~$ wget -O /dev/null https://packages.microsoft.com/repos/ms-teams
--2024-11-08 12:03:40--  https://packages.microsoft.com/repos/ms-teams
Resolving packages.microsoft.com (packages.microsoft.com)... 2620:1ec:29:1::67, 13.107.253.67
Connecting to packages.microsoft.com (packages.microsoft.com)|2620:1ec:29:1::67|:443... connected.
[[[hangs forever]]]
^C

**Comment by adamsanaglo** [comment]
We've transferred your incident to the AFD team to investigate.

**Comment by daviddavis** [comment]
@on8pz can you try to hit a random URL so we can see if your request is actually getting through to us? Try this url and then we can check our logs on our side to see if we got your request:

```
curl https://packages.microsoft.com/config/7d065977-9bc2-44b8-bbc6-05da6c6b2f8e
```

Thanks.

**Comment by on8pz** [comment]
Apologies for the delay, I was out most of yesterday.
I just executed the curl command around 16:03 CET.
As expected, no output from the server. The curl command is just hanging there.
But now you should be able to see if the request made it to the webserver.
Regards,
H.

**Comment by adamsanaglo** [comment]
We don't see your request in our logs so we're asking AFD to investigate

**Comment by mbearup** [comment]
Just to clarify, packages.microsoft.com uses Azure Front Door (AFD) to serve content to end users/customers. Since we don't see the request in our logs, we have to defer to the AFD experts to determine why the request isn't reaching the edge/caching servers.

**Comment by adamsanaglo** [comment]
@on8pz  Hello, us & the AFD team are in the process of investigating this issue. Could you please provide us with the following information:
- Traceroute information: run `sudo apt install traceroute && traceroute packages.microsoft.com`
- Your location
- If there are network devices, proxies, firewalls, etc in middle between your connection and AFD
- A tcpdump during a connection timeout:
```
sudo apt install tcpdump
sudo tcpdump -n packages.microsoft.com
curl https://packages.microsoft.com  # in a separate terminal
```

**Comment by acheng-01** [comment]
@on8pz do you have an update for us on your status? (e.g. the info requested by adamsanaglo or whether your requests are succeeding) Thanks!

**Comment by on8pz** [comment]
Sorry for the delay again, I seemed to have missed the notification from your reply last week.
I'm located in Belgium. ISP is Proximus.

All outgoing traffic from my LAN to the internet is allowed on my firewall.
No proxy.

The requested traceroute:
I have segmented my network in several VLANS and locations. The first two hops are my own routers.
My ISP seems to hide hop 3 and 4. They seem to peer directly with Microsoft since hop 5 is Proximus and hop 6 is Microsoft IP space.
I'm not sure where it goes wrong after hop 6.

`hans@late7420:~$ traceroute -6 packages.microsoft.com
traceroute to packages.microsoft.com (2620:1ec:bdf::67), 30 hops max, 80 byte packets
 1  2a02:a03f:9fbc:1f02:: (2a02:a03f:9fbc:1f02::)  2.151 ms  2.098 ms  2.077 ms
 2  2a02:a03f:9fbc:1f01::1 (2a02:a03f:9fbc:1f01::1)  22.349 ms  22.327 ms  22.310 ms
 3  * * *
 4  * * *
 5  ae-64-106.ibrstr6.isp.proximus.be (2a02:a000:1:fff4::1)  25.226 ms  25.209 ms  25.191 ms
 6  2a01:111:2000:1::3026 (2a01:111:2000:1::3026)  25.163 ms  22.770 ms  22.732 ms
 7  * * *
 8  * * *
 9  * * *
10  * * *
11  * * *
12  * * *
13  * * *
14  * * *
15  * * *
16  * * *
17  * * *
18  * * *
19  * * *
20  * * *
21  * * *
22  * * *
23  * * *
24  * * *
25  * * *
26  * * *
27  * * *
28  * * *
29  * * *
30  * * *
`

The requested tcpdump: (I did adapt the filter slightly since it did not run with the one stated in your post)

`hans@late7420:~$ curl https://packages.microsoft.com
curl: (35) Recv failure: Connection reset by peer`

tcpdump during running the above command:

`hans@late7420:~$ sudo tcpdump -n host packages.microsoft.com
tcpdump: verbose output suppressed, use -v[v]... for full protocol decode
listening on wlp0s20f3, link-type EN10MB (Ethernet), snapshot length 262144 bytes
20:51:19.043593 IP6 2a02:a03f:9fbc:1f02:70a8:8e31:d3c:9b20.57650 > 2620:1ec:bdf::67.443: Flags [S], seq 895654566, win 64800, options [mss 1440,sackOK,TS val 3530771193 ecr 0,nop,wscale 10], length 0
20:51:19.064078 IP6 2620:1ec:bdf::67.443 > 2a02:a03f:9fbc:1f02:70a8:8e31:d3c:9b20.57650: Flags [S.], seq 4102433705, ack 895654567, win 42718, options [mss 1390,sackOK,TS val 657974951 ecr 3530771193,nop,wscale 9], length 0
20:51:19.064132 IP6 2a02:a03f:9fbc:1f02:70a8:8e31:d3c:9b20.57650 > 2620:1ec:bdf::67.443: Flags [.], ack 1, win 64, options [nop,nop,TS val 3530771214 ecr 657974951], length 0
20:51:19.067599 IP6 2a02:a03f:9fbc:1f02:70a8:8e31:d3c:9b20.57650 > 2620:1ec:bdf::67.443: Flags [P.], seq 1:518, ack 1, win 64, options [nop,nop,TS val 3530771217 ecr 657974951], length 517
20:51:19.093016 IP6 2620:1ec:bdf::67.443 > 2a02:a03f:9fbc:1f02:70a8:8e31:d3c:9b20.57650: Flags [.], ack 518, win 83, options [nop,nop,TS val 657974980 ecr 3530771217], length 0
20:51:19.093373 IP6 2620:1ec:bdf::67.443 > 2a02:a03f:9fbc:1f02:70a8:8e31:d3c:9b20.57650: Flags [P.], seq 1:100, ack 518, win 83, options [nop,nop,TS val 657974980 ecr 3530771217], length 99
20:51:19.093391 IP6 2a02:a03f:9fbc:1f02:70a8:8e31:d3c:9b20.57650 > 2620:1ec:bdf::67.443: Flags [.], ack 100, win 64, options [nop,nop,TS val 3530771243 ecr 657974980], length 0
20:51:19.104698 IP6 2a02:a03f:9fbc:1f02:70a8:8e31:d3c:9b20.57650 > 2620:1ec:bdf::67.443: Flags [P.], seq 518:1041, ack 100, win 64, options [nop,nop,TS val 3530771254 ecr 657974980], length 523
20:51:19.128623 IP6 2620:1ec:bdf::67.443 > 2a02:a03f:9fbc:1f02:70a8:8e31:d3c:9b20.57650: Flags [P.], seq 2856:4196, ack 1041, win 83, options [nop,nop,TS val 657975017 ecr 3530771254], length 1340
20:51:19.128654 IP6 2a02:a03f:9fbc:1f02:70a8:8e31:d3c:9b20.57650 > 2620:1ec:bdf::67.443: Flags [.], ack 100, win 64, options [nop,nop,TS val 3530771278 ecr 657974980,nop,nop,sack 1 {2856:4196}], length 0
20:51:19.141849 IP6 2620:1ec:bdf::67.443 > 2a02:a03f:9fbc:1f02:70a8:8e31:d3c:9b20.57650: Flags [P.], seq 5574:5875, ack 1041, win 83, options [nop,nop,TS val 657975030 ecr 3530771254], length 301
20:51:19.141863 IP6 2a02:a03f:9fbc:1f02:70a8:8e31:d3c:9b20.57650 > 2620:1ec:bdf::67.443: Flags [.], ack 100, win 64, options [nop,nop,TS val 3530771291 ecr 657974980,nop,nop,sack 2 {5574:5875}{2856:4196}], length 0
20:51:24.267349 IP6 2620:1ec:bdf::67.443 > 2a02:a03f:9fbc:1f02:70a8:8e31:d3c:9b20.57650: Flags [F.], seq 5875, ack 1041, win 83, options [nop,nop,TS val 657979972 ecr 3530771291], length 0
20:51:24.267397 IP6 2a02:a03f:9fbc:1f02:70a8:8e31:d3c:9b20.57650 > 2620:1ec:bdf::67.443: Flags [.], ack 100, win 64, options [nop,nop,TS val 3530776417 ecr 657974980,nop,nop,sack 2 {5574:5876}{2856:4196}], length 0
20:52:24.324363 IP6 2a02:a03f:9fbc:1f02:70a8:8e31:d3c:9b20.57650 > 2620:1ec:bdf::67.443: Flags [.], ack 100, win 64, options [nop,nop,TS val 3530836474 ecr 657974980,nop,nop,sack 2 {5574:5876}{2856:4196}], length 0
20:52:24.353754 IP6 2620:1ec:bdf::67.443 > 2a02:a03f:9fbc:1f02:70a8:8e31:d3c:9b20.57650: Flags [.], ack 1041, win 83, options [nop,nop,TS val 658040240 ecr 3530776417], length 0
20:53:26.276148 IP6 2a02:a03f:9fbc:1f02:70a8:8e31:d3c:9b20.57650 > 2620:1ec:bdf::67.443: Flags [.], ack 100, win 64, options [nop,nop,TS val 3530898426 ecr 657974980,nop,nop,sack 2 {5574:5876}{2856:4196}], length 0
20:53:26.300932 IP6 2620:1ec:bdf::67.443 > 2a02:a03f:9fbc:1f02:70a8:8e31:d3c:9b20.57650: Flags [.], ack 1041, win 83, options [nop,nop,TS val 658102189 ecr 3530776417], length 0
20:54:27.716137 IP6 2a02:a03f:9fbc:1f02:70a8:8e31:d3c:9b20.57650 > 2620:1ec:bdf::67.443: Flags [.], ack 100, win 64, options [nop,nop,TS val 3530959866 ecr 657974980,nop,nop,sack 2 {5574:5876}{2856:4196}], length 0
20:54:27.740935 IP6 2620:1ec:bdf::67.443 > 2a02:a03f:9fbc:1f02:70a8:8e31:d3c:9b20.57650: Flags [R], seq 4102433805, win 0, length 0
`

**Comment by on8pz** [comment]
Any update on this issue ?
Still unable to reach packages.microsoft.com over ipv6...
Same error, 2620:1ec:bdf::67 not responding properly to my requests...

**Comment by daviddavis** [comment]
We have an incident opened internally with the Azure Front Door team. I requested an update a couple weeks ago but didn't hear back so I've pinged them again internally. Will update this issue when I hear back.

**Comment by on8pz** [comment]
Some more information that may be valuable to the Azure team:
Today I accidentally stumbled upon another website that happens to be hosted on the same AWS cluster, and that website has the same issues when opened from my provider ipv6 range as the packages.microsoft.com website.

hans@lent14s:~$ host packages.microsoft.com
packages.microsoft.com is an alias for pmc-prod-afd-endpoint-evdhh8f8byhsezfp.b01.azurefd.net.
pmc-prod-afd-endpoint-evdhh8f8byhsezfp.b01.azurefd.net is an alias for shed.dual-low.s-part-0039.t-0009.t-msedge.net.
shed.dual-low.s-part-0039.t-0009.t-msedge.net is an alias for azurefd-t-fb-prod.trafficmanager.net.
azurefd-t-fb-prod.trafficmanager.net is an alias for dual.s-part-0039.t-0009.fb-t-msedge.net.
dual.s-part-0039.t-0009.fb-t-msedge.net is an alias for s-part-0039.t-0009.fb-t-msedge.net.
s-part-0039.t-0009.fb-t-msedge.net has address 13.107.253.67
s-part-0039.t-0009.fb-t-msedge.net has IPv6 address **2620:1ec:29:1::67**


hans@lent14s:~$ host www.mijndigitale-meter.be
www.mijndigitale-meter.be is an alias for fdep-prod-app-dmkplus-a2encmg5bhbraqap.z01.azurefd.net.
fdep-prod-app-dmkplus-a2encmg5bhbraqap.z01.azurefd.net is an alias for star-azurefd-prod.trafficmanager.net.
star-azurefd-prod.trafficmanager.net is an alias for shed.dual-low.s-part-0039.t-0009.t-msedge.net.
shed.dual-low.s-part-0039.t-0009.t-msedge.net is an alias for azurefd-t-fb-prod.trafficmanager.net.
azurefd-t-fb-prod.trafficmanager.net is an alias for dual.s-part-0039.t-0009.fb-t-msedge.net.
dual.s-part-0039.t-0009.fb-t-msedge.net is an alias for s-part-0039.t-0009.fb-t-msedge.net.
s-part-0039.t-0009.fb-t-msedge.net has address 13.107.253.67_
s-part-0039.t-0009.fb-t-msedge.net has IPv6 address **2620:1ec:29:1::67**


Could you please pass this on to the Azure Front Door team ? Thanks!

**Comment by daviddavis** [comment]
@on8pz I heard back from the AFD team. They need more information to debug. Can you try running this command to get the (note the `-A` flag): `sudo tcpdump -A -n host packages.microsoft.com` and then submit a request `curl http://packages.microsoft.com/` (note the http protocol instead of https). Thanks.

**Comment by on8pz** [comment]
Hmm, not sure what happened, but the issue seems to be resolved.
I cannot reproduce the problem anymore.

Connections to packages.microsoft.com over HTTP or HTTPS now work as they should.
Both ipv4 and ipv6, same ip addresses 13.107.253.67 and 2620:1ec:29:1::67.

I guess that's a good thing, although I would have preferred to know what the cause of the issue was.

Thanks for your time!

**Comment by daviddavis** [comment]
Thanks for the update @on8pz. Since you can no longer reproduce this and we don't have enough information to investigate further, I am going to close this. If you are able to reproduce it again, please reopen this and attach a tcpdump with `-A`.
