### ISSUE TITLE
dnf cannot pull packages from packages.microsoft.com due to: Connection reset by peer

### ISSUE THREAD

**Issue by SingingBush** [microsoft/linux-package-repositories#237]
**Describe the issue**

Downloading rpm packages from packages.microsoft.com has been painfully slow for about a week. Every time I run `dnf update` I get errors like:

`Curl error (56): Failure when receiving data from the peer for https://packages.microsoft.com/rhel/9.0/prod/Packages/d/dotnet-sdk-9.0-9.0.303-1.x86_64.rpm [Recv failure: Connection reset by peer]`

If I go to https://packages.microsoft.com/rhel/9.0/prod/Packages/d/ in a browser I can see the `dotnet-sdk-9.0-9.0.303-1.x86_64.rpm` file there.

**When did the issue occur?**
multiple times. Every time I attempt to update my Fedora machine

**If applicable, what package did you attempt to install, and from which repo?**

dotnet-sdk-9

**Steps to Reproduce**
use *dnf* on Fedora with the packages.microsoft.com repo to install dotnet sdk

**Actual Result**
`Connection reset by peer`

**Expected Result**
The package should get updated

**Screenshots**
<img alt="Image" src="https://github.com/user-attachments/assets/5cca0f55-4447-4d1f-aeec-f78619c78cd7" />

**Additional context**

**Comment by mbearup** [comment]
@SingingBush - packages.microsoft.com uses Azure Front Door for content distribution, so the issue you're experiencing is most likely a caching issue at your nearest Point-of-Presence (PoP). If you could run the following command and capture the output (particularly the `x-ms-request-id`) that should help us diagnose the issue with the Azure Front Door team.
```
curl -v --output dotnet.rpm https://packages.microsoft.com/rhel/9.0/prod/Packages/d/dotnet-sdk-9.0-9.0.303-1.x86_64.rpm
```

**Comment by SingingBush** [comment]
```
* IPv6: 2620:1ec:bdf::64
* IPv4: 13.107.246.64
*   Trying [2620:1ec:bdf::64]:443...
* ALPN: curl offers h2,http/1.1
} [5 bytes data]
* TLSv1.3 (OUT), TLS handshake, Client hello (1):
} [512 bytes data]
*  CAfile: /etc/pki/ca-trust/extracted/pem/tls-ca-bundle.pem
*  CApath: none
{ [5 bytes data]
* TLSv1.3 (IN), TLS handshake, Server hello (2):
{ [88 bytes data]
* TLSv1.3 (OUT), TLS change cipher, Change cipher spec (1):
} [1 bytes data]
* TLSv1.3 (OUT), TLS handshake, Client hello (1):
} [512 bytes data]
* TLSv1.3 (IN), TLS handshake, Server hello (2):
{ [155 bytes data]
* TLSv1.3 (IN), TLS handshake, Encrypted Extensions (8):
{ [19 bytes data]
* TLSv1.3 (IN), TLS handshake, Certificate (11):
{ [4937 bytes data]
* TLSv1.3 (IN), TLS handshake, CERT verify (15):
{ [520 bytes data]
* TLSv1.3 (IN), TLS handshake, Finished (20):
{ [52 bytes data]
* TLSv1.3 (OUT), TLS handshake, Finished (20):
} [52 bytes data]
* SSL connection using TLSv1.3 / TLS_AES_256_GCM_SHA384 / secp256r1 / RSASSA-PSS
* ALPN: server accepted h2
* Server certificate:
*  subject: C=US; ST=WA; L=Redmond; O=Microsoft Corporation; CN=packages.microsoft.com
*  start date: Jun 16 10:07:26 2025 GMT
*  expire date: Dec 13 10:07:26 2025 GMT
*  subjectAltName: host "packages.microsoft.com" matched cert's "packages.microsoft.com"
*  issuer: C=US; O=Microsoft Corporation; CN=Microsoft Azure RSA TLS Issuing CA 03
*  SSL certificate verify ok.
*   Certificate level 0: Public key type RSA (4096/152 Bits/secBits), signed using sha384WithRSAEncryption
*   Certificate level 1: Public key type RSA (4096/152 Bits/secBits), signed using sha384WithRSAEncryption
*   Certificate level 2: Public key type RSA (2048/112 Bits/secBits), signed using sha256WithRSAEncryption
* Connected to packages.microsoft.com (2620:1ec:bdf::64) port 443
* using HTTP/2
* [HTTP/2] [1] OPENED stream for https://packages.microsoft.com/rhel/9.0/prod/Packages/d/dotnet-sdk-9.0-9.0.303-1.x86_64.rpm
* [HTTP/2] [1] [:method: GET]
* [HTTP/2] [1] [:scheme: https]
* [HTTP/2] [1] [:authority: packages.microsoft.com]
* [HTTP/2] [1] [:path: /rhel/9.0/prod/Packages/d/dotnet-sdk-9.0-9.0.303-1.x86_64.rpm]
* [HTTP/2] [1] [user-agent: curl/8.11.1]
* [HTTP/2] [1] [accept: */*]
} [5 bytes data]
> GET /rhel/9.0/prod/Packages/d/dotnet-sdk-9.0-9.0.303-1.x86_64.rpm HTTP/2
> Host: packages.microsoft.com
> User-Agent: curl/8.11.1
> Accept: */*
> 
* Request completely sent off
{ [5 bytes data]
* TLSv1.3 (IN), TLS handshake, Newsession Ticket (4):
{ [281 bytes data]
* TLSv1.3 (IN), TLS handshake, Newsession Ticket (4):
{ [281 bytes data]
< HTTP/2 200 
< date: Sun, 20 Jul 2025 15:35:51 GMT
< content-type: application/octet-stream
< content-length: 154371030
< last-modified: Thu, 17 Jul 2025 17:45:05 GMT
< etag: "0x8DDC559AA3F56DF"
< x-ms-request-id: 3feb3728-501e-0006-397c-f75715000000
< x-ms-version: 2025-05-05
< x-ms-version-id: 2025-07-17T17:45:05.5517407Z
< x-ms-is-current-version: true
< x-ms-creation-time: Thu, 17 Jul 2025 17:45:05 GMT
< x-ms-lease-status: unlocked
< x-ms-lease-state: available
< x-ms-blob-type: BlockBlob
< content-disposition: attachment;filename=dotnet-sdk-9.0-9.0.303-1.x86_64.rpm
< x-ms-server-encrypted: true
< x-ms-last-access-time: Thu, 17 Jul 2025 17:45:06 GMT
< strict-transport-security: max-age=31536000; includeSubDomains
< x-content-type-options: nosniff
< x-azure-ref: 20250720T153551Z-16896f46f999hhlvhC1LTS9ws800000000s0000000004zq5
< x-cache: TCP_HIT
< cache-control: public, max-age=31536000
< x-fd-int-roxy-purgeid: 66952808
< x-cache-info: L1_T2
< accept-ranges: bytes
< 
{ [8192 bytes data]
100  147M  100  147M    0     0  2351k      0  0:01:04  0:01:04 --:--:--  876k
* Connection #0 to host packages.microsoft.com left intact
```

**Comment by adamsanaglo** [comment]
@SingingBush Are you aware of any network devices, proxies or firewalls set up in between you and AFD?

Could you also kindly provide a tcpdump using: `sudo dnf install -y tcpdump && sudo tcpdump -n host packages.microsoft.com
` then running `curl https://packages.microsoft.com` in a separate terminal
Additionally, a traceroute would be helpful: `sudo dnf install traceroute && traceroute packages.microsoft.com`

Let me know if you hit any issues and if the error is still persisting.

**Comment by SingingBush** [comment]
I'm not using anything that should interfere with outbound requests to Azure.

tcp dump:

```
dropped privs to tcpdump
tcpdump: verbose output suppressed, use -v[v]... for full protocol decode
listening on enp5s0, link-type EN10MB (Ethernet), snapshot length 262144 bytes
18:23:37.669588 IP6 2a00:23c5:f4cd:db01::b85.56278 > 2620:1ec:bdf::64.https: Flags [S], seq 3801219935, win 64440, options [mss 1432,sackOK,TS val 2573830564 ecr 0,nop,wscale 7], length 0
18:23:37.699507 IP6 2620:1ec:bdf::64.https > 2a00:23c5:f4cd:db01::b85.56278: Flags [S.], seq 1631370681, ack 3801219936, win 42718, options [mss 1390,sackOK,TS val 1971082839 ecr 2573830564,nop,wscale 9], length 0
18:23:37.699556 IP6 2a00:23c5:f4cd:db01::b85.56278 > 2620:1ec:bdf::64.https: Flags [.], ack 1, win 504, options [nop,nop,TS val 2573830594 ecr 1971082839], length 0
18:23:37.701941 IP6 2a00:23c5:f4cd:db01::b85.56278 > 2620:1ec:bdf::64.https: Flags [P.], seq 1:518, ack 1, win 504, options [nop,nop,TS val 2573830597 ecr 1971082839], length 517
18:23:37.721174 IP6 2620:1ec:bdf::64.https > 2a00:23c5:f4cd:db01::b85.56278: Flags [.], ack 518, win 83, options [nop,nop,TS val 1971082860 ecr 2573830597], length 0
18:23:37.724203 IP6 2620:1ec:bdf::64.https > 2a00:23c5:f4cd:db01::b85.56278: Flags [P.], seq 1:100, ack 518, win 83, options [nop,nop,TS val 1971082860 ecr 2573830597], length 99
18:23:37.724220 IP6 2a00:23c5:f4cd:db01::b85.56278 > 2620:1ec:bdf::64.https: Flags [.], ack 100, win 504, options [nop,nop,TS val 2573830619 ecr 1971082860], length 0
18:23:37.724423 IP6 2a00:23c5:f4cd:db01::b85.56278 > 2620:1ec:bdf::64.https: Flags [P.], seq 518:1041, ack 100, win 504, options [nop,nop,TS val 2573830619 ecr 1971082860], length 523
18:23:37.742132 IP6 2620:1ec:bdf::64.https > 2a00:23c5:f4cd:db01::b85.56278: Flags [.], seq 100:1478, ack 1041, win 83, options [nop,nop,TS val 1971082881 ecr 2573830619], length 1378
18:23:37.742227 IP6 2620:1ec:bdf::64.https > 2a00:23c5:f4cd:db01::b85.56278: Flags [P.], seq 1478:2856, ack 1041, win 83, options [nop,nop,TS val 1971082881 ecr 2573830619], length 1378
18:23:37.742243 IP6 2a00:23c5:f4cd:db01::b85.56278 > 2620:1ec:bdf::64.https: Flags [.], ack 2856, win 549, options [nop,nop,TS val 2573830637 ecr 1971082881], length 0
18:23:37.742342 IP6 2620:1ec:bdf::64.https > 2a00:23c5:f4cd:db01::b85.56278: Flags [P.], seq 2856:4196, ack 1041, win 83, options [nop,nop,TS val 1971082881 ecr 2573830619], length 1340
18:23:37.747016 IP6 2620:1ec:bdf::64.https > 2a00:23c5:f4cd:db01::b85.56278: Flags [P.], seq 4196:5876, ack 1041, win 83, options [nop,nop,TS val 1971082888 ecr 2573830619], length 1680
18:23:37.747038 IP6 2a00:23c5:f4cd:db01::b85.56278 > 2620:1ec:bdf::64.https: Flags [.], ack 5876, win 597, options [nop,nop,TS val 2573830642 ecr 1971082881], length 0
18:23:37.747902 IP6 2a00:23c5:f4cd:db01::b85.56278 > 2620:1ec:bdf::64.https: Flags [P.], seq 1041:1115, ack 5876, win 597, options [nop,nop,TS val 2573830642 ecr 1971082881], length 74
18:23:37.748047 IP6 2a00:23c5:f4cd:db01::b85.56278 > 2620:1ec:bdf::64.https: Flags [P.], seq 1115:1245, ack 5876, win 597, options [nop,nop,TS val 2573830643 ecr 1971082881], length 130
18:23:37.762345 IP6 2620:1ec:bdf::64.https > 2a00:23c5:f4cd:db01::b85.56278: Flags [P.], seq 5876:6179, ack 1115, win 83, options [nop,nop,TS val 1971082902 ecr 2573830642], length 303
18:23:37.763082 IP6 2620:1ec:bdf::64.https > 2a00:23c5:f4cd:db01::b85.56278: Flags [P.], seq 6179:6482, ack 1115, win 83, options [nop,nop,TS val 1971082902 ecr 2573830642], length 303
18:23:37.763115 IP6 2a00:23c5:f4cd:db01::b85.56278 > 2620:1ec:bdf::64.https: Flags [.], ack 6482, win 640, options [nop,nop,TS val 2573830658 ecr 1971082902], length 0
18:23:37.763117 IP6 2620:1ec:bdf::64.https > 2a00:23c5:f4cd:db01::b85.56278: Flags [P.], seq 6482:6544, ack 1115, win 83, options [nop,nop,TS val 1971082903 ecr 2573830642], length 62
18:23:37.763117 IP6 2620:1ec:bdf::64.https > 2a00:23c5:f4cd:db01::b85.56278: Flags [P.], seq 6544:6575, ack 1245, win 83, options [nop,nop,TS val 1971082906 ecr 2573830643], length 31
18:23:37.763163 IP6 2a00:23c5:f4cd:db01::b85.56278 > 2620:1ec:bdf::64.https: Flags [.], ack 6575, win 640, options [nop,nop,TS val 2573830658 ecr 1971082903], length 0
18:23:37.763183 IP6 2a00:23c5:f4cd:db01::b85.56278 > 2620:1ec:bdf::64.https: Flags [P.], seq 1245:1276, ack 6575, win 640, options [nop,nop,TS val 2573830658 ecr 1971082903], length 31
18:23:37.772659 IP6 2620:1ec:bdf::64.https > 2a00:23c5:f4cd:db01::b85.56278: Flags [.], seq 6575:7953, ack 1245, win 83, options [nop,nop,TS val 1971082912 ecr 2573830643], length 1378
18:23:37.772754 IP6 2620:1ec:bdf::64.https > 2a00:23c5:f4cd:db01::b85.56278: Flags [P.], seq 7953:9331, ack 1245, win 83, options [nop,nop,TS val 1971082912 ecr 2573830643], length 1378
18:23:37.772768 IP6 2a00:23c5:f4cd:db01::b85.56278 > 2620:1ec:bdf::64.https: Flags [.], ack 9331, win 658, options [nop,nop,TS val 2573830667 ecr 1971082912], length 0
18:23:37.772799 IP6 2620:1ec:bdf::64.https > 2a00:23c5:f4cd:db01::b85.56278: Flags [P.], seq 9331:9632, ack 1245, win 83, options [nop,nop,TS val 1971082912 ecr 2573830643], length 301
18:23:37.773143 IP6 2a00:23c5:f4cd:db01::b85.56278 > 2620:1ec:bdf::64.https: Flags [P.], seq 1276:1324, ack 9632, win 663, options [nop,nop,TS val 2573830668 ecr 1971082912], length 48
18:23:37.773173 IP6 2a00:23c5:f4cd:db01::b85.56278 > 2620:1ec:bdf::64.https: Flags [P.], seq 1324:1348, ack 9632, win 663, options [nop,nop,TS val 2573830668 ecr 1971082912], length 24
18:23:37.773760 IP6 2a00:23c5:f4cd:db01::b85.56278 > 2620:1ec:bdf::64.https: Flags [F.], seq 1348, ack 9632, win 663, options [nop,nop,TS val 2573830668 ecr 1971082912], length 0
18:23:37.785775 IP6 2620:1ec:bdf::64.https > 2a00:23c5:f4cd:db01::b85.56278: Flags [.], ack 1324, win 83, options [nop,nop,TS val 1971082927 ecr 2573830658], length 0
18:23:37.786463 IP6 2620:1ec:bdf::64.https > 2a00:23c5:f4cd:db01::b85.56278: Flags [F.], seq 9632, ack 1348, win 83, options [nop,nop,TS val 1971082928 ecr 2573830668], length 0
18:23:37.786490 IP6 2a00:23c5:f4cd:db01::b85.56278 > 2620:1ec:bdf::64.https: Flags [.], ack 9633, win 663, options [nop,nop,TS val 2573830681 ecr 1971082928], length 0
18:23:37.787213 IP6 2620:1ec:bdf::64.https > 2a00:23c5:f4cd:db01::b85.56278: Flags [.], ack 1349, win 83, options [nop,nop,TS val 1971082929 ecr 2573830668], length 0
```

traceroute:

```
traceroute to packages.microsoft.com (2620:1ec:bdf::64), 30 hops max, 80 byte packets
 1  2a00:23c5:f4cd:db01::1 (2a00:23c5:f4cd:db01::1)  7.974 ms  16.715 ms  16.642 ms
 2  * * *
 3  * * *
 4  * * *
 5  2a00:2380:107::41 (2a00:2380:107::41)  32.145 ms 2a00:2380:107::55 (2a00:2380:107::55)  25.041 ms 2a00:2380:107::b (2a00:2380:107::b)  32.046 ms
 6  2a01:111:2000:1::d81 (2a01:111:2000:1::d81)  32.057 ms 2a01:111:2000:1::ed5 (2a01:111:2000:1::ed5)  18.195 ms 2a01:111:2000:1::d81 (2a01:111:2000:1::d81)  26.284 ms
 7  2a01:111:2000:2:8000::1c59 (2a01:111:2000:2:8000::1c59)  26.289 ms 2a01:111:0:133::c52 (2a01:111:0:133::c52)  26.258 ms 2a01:111:0:133::c5e (2a01:111:0:133::c5e)  26.181 ms
 8  * * be102.ibr01.lon24.ntwk.msn.net (2603:1060:1:12::f19a)  33.753 ms
 9  * 2603:1060:1:10::f869 (2603:1060:1:10::f869)  64.736 ms *
10  2a01:111:2000:6::56e5 (2a01:111:2000:6::56e5)  33.598 ms * *
11  * * *
12  * * *
13  * * *
14  * * *
15  * * *
16  * * *
17  * * *
18  * * *
19  * * *
20  * * *
21  * * *
22  * * *
23  * * *
24  * * *
25  * * *
26  * * *
27  * * *
28  * * *
29  * * *
30  * * *
```

**Comment by adamsanaglo** [comment]
@SingingBush I have purged the affected file from cache. Kindly let us know if you're still experiencing the issue

**Comment by SingingBush** [comment]
I ran `sudo tcpdump -n host packages.microsoft.com` in a terminal while running `curl -v --output dotnet.rpm https://packages.microsoft.com/rhel/9.0/prod/Packages/d/dotnet-sdk-9.0-9.0.303-1.x86_64.rpm` in another. I was able to retrieve the whole file on the first attempt.
